
*** Running vivado
    with args -log dino_top.vds -m64 -product Vivado -mode batch -messageDb vivado.pb -notrace -source dino_top.tcl


****** Vivado v2019.2 (64-bit)
  **** SW Build 2708876 on Wed Nov  6 21:40:23 MST 2019
  **** IP Build 2700528 on Thu Nov  7 00:09:20 MST 2019
    ** Copyright 1986-2019 Xilinx, Inc. All Rights Reserved.

source dino_top.tcl -notrace
Command: synth_design -top dino_top -part xc7a35tcpg236-1
Starting synth_design
Attempting to get a license for feature 'Synthesis' and/or device 'xc7a35t'
INFO: [Common 17-349] Got license for feature 'Synthesis' and/or device 'xc7a35t'
INFO: [Device 21-403] Loading part xc7a35tcpg236-1
INFO: Launching helper process for spawning children vivado processes
INFO: Helper process launched with PID 25704 
WARNING: [Synth 8-2507] parameter declaration becomes local in KeyboardCtrl with formal parameter declaration list [C:/Users/jaylu/Desktop/Ethan/HardwareDesign_finalproject/Hardware_Design_Lab_Final_Project/ip/Keyboard-Controller/keyboard_cntr_1.0/src/KeyboardCtrl.v:18]
WARNING: [Synth 8-2507] parameter declaration becomes local in KeyboardCtrl with formal parameter declaration list [C:/Users/jaylu/Desktop/Ethan/HardwareDesign_finalproject/Hardware_Design_Lab_Final_Project/ip/Keyboard-Controller/keyboard_cntr_1.0/src/KeyboardCtrl.v:19]
WARNING: [Synth 8-2507] parameter declaration becomes local in KeyboardCtrl with formal parameter declaration list [C:/Users/jaylu/Desktop/Ethan/HardwareDesign_finalproject/Hardware_Design_Lab_Final_Project/ip/Keyboard-Controller/keyboard_cntr_1.0/src/KeyboardCtrl.v:20]
WARNING: [Synth 8-2507] parameter declaration becomes local in KeyboardCtrl with formal parameter declaration list [C:/Users/jaylu/Desktop/Ethan/HardwareDesign_finalproject/Hardware_Design_Lab_Final_Project/ip/Keyboard-Controller/keyboard_cntr_1.0/src/KeyboardCtrl.v:21]
WARNING: [Synth 8-2507] parameter declaration becomes local in KeyboardCtrl with formal parameter declaration list [C:/Users/jaylu/Desktop/Ethan/HardwareDesign_finalproject/Hardware_Design_Lab_Final_Project/ip/Keyboard-Controller/keyboard_cntr_1.0/src/KeyboardCtrl.v:22]
WARNING: [Synth 8-2507] parameter declaration becomes local in KeyboardCtrl with formal parameter declaration list [C:/Users/jaylu/Desktop/Ethan/HardwareDesign_finalproject/Hardware_Design_Lab_Final_Project/ip/Keyboard-Controller/keyboard_cntr_1.0/src/KeyboardCtrl.v:23]
WARNING: [Synth 8-2507] parameter declaration becomes local in KeyboardCtrl with formal parameter declaration list [C:/Users/jaylu/Desktop/Ethan/HardwareDesign_finalproject/Hardware_Design_Lab_Final_Project/ip/Keyboard-Controller/keyboard_cntr_1.0/src/KeyboardCtrl.v:24]
WARNING: [Synth 8-2507] parameter declaration becomes local in KeyboardCtrl with formal parameter declaration list [C:/Users/jaylu/Desktop/Ethan/HardwareDesign_finalproject/Hardware_Design_Lab_Final_Project/ip/Keyboard-Controller/keyboard_cntr_1.0/src/KeyboardCtrl.v:26]
WARNING: [Synth 8-2507] parameter declaration becomes local in KeyboardCtrl with formal parameter declaration list [C:/Users/jaylu/Desktop/Ethan/HardwareDesign_finalproject/Hardware_Design_Lab_Final_Project/ip/Keyboard-Controller/keyboard_cntr_1.0/src/KeyboardCtrl.v:27]
WARNING: [Synth 8-2507] parameter declaration becomes local in KeyboardCtrl with formal parameter declaration list [C:/Users/jaylu/Desktop/Ethan/HardwareDesign_finalproject/Hardware_Design_Lab_Final_Project/ip/Keyboard-Controller/keyboard_cntr_1.0/src/KeyboardCtrl.v:28]
WARNING: [Synth 8-2507] parameter declaration becomes local in KeyboardCtrl with formal parameter declaration list [C:/Users/jaylu/Desktop/Ethan/HardwareDesign_finalproject/Hardware_Design_Lab_Final_Project/ip/Keyboard-Controller/keyboard_cntr_1.0/src/KeyboardCtrl.v:29]
WARNING: [Synth 8-2507] parameter declaration becomes local in KeyboardCtrl with formal parameter declaration list [C:/Users/jaylu/Desktop/Ethan/HardwareDesign_finalproject/Hardware_Design_Lab_Final_Project/ip/Keyboard-Controller/keyboard_cntr_1.0/src/KeyboardCtrl.v:31]
WARNING: [Synth 8-2507] parameter declaration becomes local in KeyboardCtrl with formal parameter declaration list [C:/Users/jaylu/Desktop/Ethan/HardwareDesign_finalproject/Hardware_Design_Lab_Final_Project/ip/Keyboard-Controller/keyboard_cntr_1.0/src/KeyboardCtrl.v:32]
WARNING: [Synth 8-2507] parameter declaration becomes local in KeyboardCtrl with formal parameter declaration list [C:/Users/jaylu/Desktop/Ethan/HardwareDesign_finalproject/Hardware_Design_Lab_Final_Project/ip/Keyboard-Controller/keyboard_cntr_1.0/src/KeyboardCtrl.v:33]
WARNING: [Synth 8-2507] parameter declaration becomes local in KeyboardCtrl with formal parameter declaration list [C:/Users/jaylu/Desktop/Ethan/HardwareDesign_finalproject/Hardware_Design_Lab_Final_Project/ip/Keyboard-Controller/keyboard_cntr_1.0/src/KeyboardCtrl.v:34]
WARNING: [Synth 8-2507] parameter declaration becomes local in KeyboardCtrl with formal parameter declaration list [C:/Users/jaylu/Desktop/Ethan/HardwareDesign_finalproject/Hardware_Design_Lab_Final_Project/ip/Keyboard-Controller/keyboard_cntr_1.0/src/KeyboardCtrl.v:35]
WARNING: [Synth 8-2507] parameter declaration becomes local in Ps2Interface with formal parameter declaration list [C:/Users/jaylu/Desktop/Ethan/HardwareDesign_finalproject/Hardware_Design_Lab_Final_Project/ip/Keyboard-Controller/keyboard_cntr_1.0/src/Ps2Interface.v:191]
WARNING: [Synth 8-2507] parameter declaration becomes local in Ps2Interface with formal parameter declaration list [C:/Users/jaylu/Desktop/Ethan/HardwareDesign_finalproject/Hardware_Design_Lab_Final_Project/ip/Keyboard-Controller/keyboard_cntr_1.0/src/Ps2Interface.v:192]
WARNING: [Synth 8-2507] parameter declaration becomes local in Ps2Interface with formal parameter declaration list [C:/Users/jaylu/Desktop/Ethan/HardwareDesign_finalproject/Hardware_Design_Lab_Final_Project/ip/Keyboard-Controller/keyboard_cntr_1.0/src/Ps2Interface.v:193]
WARNING: [Synth 8-2507] parameter declaration becomes local in Ps2Interface with formal parameter declaration list [C:/Users/jaylu/Desktop/Ethan/HardwareDesign_finalproject/Hardware_Design_Lab_Final_Project/ip/Keyboard-Controller/keyboard_cntr_1.0/src/Ps2Interface.v:194]
WARNING: [Synth 8-2507] parameter declaration becomes local in Ps2Interface with formal parameter declaration list [C:/Users/jaylu/Desktop/Ethan/HardwareDesign_finalproject/Hardware_Design_Lab_Final_Project/ip/Keyboard-Controller/keyboard_cntr_1.0/src/Ps2Interface.v:229]
WARNING: [Synth 8-2507] parameter declaration becomes local in Ps2Interface with formal parameter declaration list [C:/Users/jaylu/Desktop/Ethan/HardwareDesign_finalproject/Hardware_Design_Lab_Final_Project/ip/Keyboard-Controller/keyboard_cntr_1.0/src/Ps2Interface.v:231]
WARNING: [Synth 8-2507] parameter declaration becomes local in Ps2Interface with formal parameter declaration list [C:/Users/jaylu/Desktop/Ethan/HardwareDesign_finalproject/Hardware_Design_Lab_Final_Project/ip/Keyboard-Controller/keyboard_cntr_1.0/src/Ps2Interface.v:232]
WARNING: [Synth 8-2507] parameter declaration becomes local in Ps2Interface with formal parameter declaration list [C:/Users/jaylu/Desktop/Ethan/HardwareDesign_finalproject/Hardware_Design_Lab_Final_Project/ip/Keyboard-Controller/keyboard_cntr_1.0/src/Ps2Interface.v:233]
WARNING: [Synth 8-2507] parameter declaration becomes local in Ps2Interface with formal parameter declaration list [C:/Users/jaylu/Desktop/Ethan/HardwareDesign_finalproject/Hardware_Design_Lab_Final_Project/ip/Keyboard-Controller/keyboard_cntr_1.0/src/Ps2Interface.v:234]
WARNING: [Synth 8-2507] parameter declaration becomes local in Ps2Interface with formal parameter declaration list [C:/Users/jaylu/Desktop/Ethan/HardwareDesign_finalproject/Hardware_Design_Lab_Final_Project/ip/Keyboard-Controller/keyboard_cntr_1.0/src/Ps2Interface.v:235]
WARNING: [Synth 8-2507] parameter declaration becomes local in Ps2Interface with formal parameter declaration list [C:/Users/jaylu/Desktop/Ethan/HardwareDesign_finalproject/Hardware_Design_Lab_Final_Project/ip/Keyboard-Controller/keyboard_cntr_1.0/src/Ps2Interface.v:236]
WARNING: [Synth 8-2507] parameter declaration becomes local in Ps2Interface with formal parameter declaration list [C:/Users/jaylu/Desktop/Ethan/HardwareDesign_finalproject/Hardware_Design_Lab_Final_Project/ip/Keyboard-Controller/keyboard_cntr_1.0/src/Ps2Interface.v:237]
WARNING: [Synth 8-2507] parameter declaration becomes local in Ps2Interface with formal parameter declaration list [C:/Users/jaylu/Desktop/Ethan/HardwareDesign_finalproject/Hardware_Design_Lab_Final_Project/ip/Keyboard-Controller/keyboard_cntr_1.0/src/Ps2Interface.v:238]
WARNING: [Synth 8-2507] parameter declaration becomes local in Ps2Interface with formal parameter declaration list [C:/Users/jaylu/Desktop/Ethan/HardwareDesign_finalproject/Hardware_Design_Lab_Final_Project/ip/Keyboard-Controller/keyboard_cntr_1.0/src/Ps2Interface.v:239]
WARNING: [Synth 8-2507] parameter declaration becomes local in Ps2Interface with formal parameter declaration list [C:/Users/jaylu/Desktop/Ethan/HardwareDesign_finalproject/Hardware_Design_Lab_Final_Project/ip/Keyboard-Controller/keyboard_cntr_1.0/src/Ps2Interface.v:240]
WARNING: [Synth 8-2507] parameter declaration becomes local in Ps2Interface with formal parameter declaration list [C:/Users/jaylu/Desktop/Ethan/HardwareDesign_finalproject/Hardware_Design_Lab_Final_Project/ip/Keyboard-Controller/keyboard_cntr_1.0/src/Ps2Interface.v:241]
WARNING: [Synth 8-2507] parameter declaration becomes local in Ps2Interface with formal parameter declaration list [C:/Users/jaylu/Desktop/Ethan/HardwareDesign_finalproject/Hardware_Design_Lab_Final_Project/ip/Keyboard-Controller/keyboard_cntr_1.0/src/Ps2Interface.v:242]
WARNING: [Synth 8-2507] parameter declaration becomes local in Ps2Interface with formal parameter declaration list [C:/Users/jaylu/Desktop/Ethan/HardwareDesign_finalproject/Hardware_Design_Lab_Final_Project/ip/Keyboard-Controller/keyboard_cntr_1.0/src/Ps2Interface.v:243]
WARNING: [Synth 8-2507] parameter declaration becomes local in Ps2Interface with formal parameter declaration list [C:/Users/jaylu/Desktop/Ethan/HardwareDesign_finalproject/Hardware_Design_Lab_Final_Project/ip/Keyboard-Controller/keyboard_cntr_1.0/src/Ps2Interface.v:244]
WARNING: [Synth 8-2507] parameter declaration becomes local in Ps2Interface with formal parameter declaration list [C:/Users/jaylu/Desktop/Ethan/HardwareDesign_finalproject/Hardware_Design_Lab_Final_Project/ip/Keyboard-Controller/keyboard_cntr_1.0/src/Ps2Interface.v:245]
---------------------------------------------------------------------------------
Starting RTL Elaboration : Time (s): cpu = 00:00:03 ; elapsed = 00:00:03 . Memory (MB): peak = 786.008 ; gain = 241.477
---------------------------------------------------------------------------------
INFO: [Synth 8-6157] synthesizing module 'dino_top' [C:/Users/jaylu/Desktop/Ethan/HardwareDesign_finalproject/Hardware_Design_Lab_Final_Project/dino_top.v:1]
INFO: [Synth 8-6157] synthesizing module 'clock_divider' [C:/Users/jaylu/Desktop/Ethan/HardwareDesign_finalproject/Hardware_Design_Lab_Final_Project/clock_divider.v:1]
	Parameter n bound to: 2 - type: integer 
INFO: [Synth 8-6155] done synthesizing module 'clock_divider' (1#1) [C:/Users/jaylu/Desktop/Ethan/HardwareDesign_finalproject/Hardware_Design_Lab_Final_Project/clock_divider.v:1]
INFO: [Synth 8-6157] synthesizing module 'vga_controller' [C:/Users/jaylu/Desktop/Ethan/HardwareDesign_finalproject/Hardware_Design_Lab_Final_Project/vga.v:6]
	Parameter HD bound to: 640 - type: integer 
	Parameter HF bound to: 16 - type: integer 
	Parameter HS bound to: 96 - type: integer 
	Parameter HB bound to: 48 - type: integer 
	Parameter HT bound to: 800 - type: integer 
	Parameter VD bound to: 480 - type: integer 
	Parameter VF bound to: 10 - type: integer 
	Parameter VS bound to: 2 - type: integer 
	Parameter VB bound to: 33 - type: integer 
	Parameter VT bound to: 525 - type: integer 
	Parameter hsync_default bound to: 1'b1 
	Parameter vsync_default bound to: 1'b1 
INFO: [Synth 8-6155] done synthesizing module 'vga_controller' (2#1) [C:/Users/jaylu/Desktop/Ethan/HardwareDesign_finalproject/Hardware_Design_Lab_Final_Project/vga.v:6]
INFO: [Synth 8-6157] synthesizing module 'debounce' [C:/Users/jaylu/Desktop/Ethan/HardwareDesign_finalproject/Hardware_Design_Lab_Final_Project/debounce.v:1]
INFO: [Synth 8-6155] done synthesizing module 'debounce' (3#1) [C:/Users/jaylu/Desktop/Ethan/HardwareDesign_finalproject/Hardware_Design_Lab_Final_Project/debounce.v:1]
INFO: [Synth 8-6157] synthesizing module 'one_pulse' [C:/Users/jaylu/Desktop/Ethan/HardwareDesign_finalproject/Hardware_Design_Lab_Final_Project/one_pulse.v:1]
INFO: [Synth 8-6155] done synthesizing module 'one_pulse' (4#1) [C:/Users/jaylu/Desktop/Ethan/HardwareDesign_finalproject/Hardware_Design_Lab_Final_Project/one_pulse.v:1]
INFO: [Synth 8-6157] synthesizing module 'KeyboardDecoder' [C:/Users/jaylu/Desktop/Ethan/HardwareDesign_finalproject/Hardware_Design_Lab_Final_Project/KeyboardDecoder.v:1]
	Parameter INIT bound to: 2'b00 
	Parameter WAIT_FOR_SIGNAL bound to: 2'b01 
	Parameter GET_SIGNAL_DOWN bound to: 2'b10 
	Parameter WAIT_RELEASE bound to: 2'b11 
	Parameter IS_INIT bound to: 8'b10101010 
	Parameter IS_EXTEND bound to: 8'b11100000 
	Parameter IS_BREAK bound to: 8'b11110000 
INFO: [Synth 8-6157] synthesizing module 'KeyboardCtrl' [C:/Users/jaylu/Desktop/Ethan/HardwareDesign_finalproject/Hardware_Design_Lab_Final_Project/ip/Keyboard-Controller/keyboard_cntr_1.0/src/KeyboardCtrl.v:1]
	Parameter SYSCLK_FREQUENCY_HZ bound to: 100000000 - type: integer 
	Parameter RESET bound to: 3'b000 
	Parameter SEND_CMD bound to: 3'b001 
	Parameter WAIT_ACK bound to: 3'b010 
	Parameter WAIT_KEYIN bound to: 3'b011 
	Parameter GET_BREAK bound to: 3'b100 
	Parameter GET_EXTEND bound to: 3'b101 
	Parameter RESET_WAIT_BAT bound to: 3'b110 
	Parameter CMD_RESET bound to: 8'b11111111 
	Parameter CMD_SET_STATUS_LEDS bound to: 8'b11101101 
	Parameter RSP_ACK bound to: 8'b11111010 
	Parameter RSP_BAT_PASS bound to: 8'b10101010 
	Parameter BREAK_CODE bound to: 8'b11110000 
	Parameter EXTEND_CODE bound to: 8'b11100000 
	Parameter CAPS_LOCK bound to: 8'b01011000 
	Parameter NUM_LOCK bound to: 8'b01110111 
	Parameter SCR_LOCK bound to: 8'b01111110 
INFO: [Synth 8-6157] synthesizing module 'Ps2Interface' [C:/Users/jaylu/Desktop/Ethan/HardwareDesign_finalproject/Hardware_Design_Lab_Final_Project/ip/Keyboard-Controller/keyboard_cntr_1.0/src/Ps2Interface.v:164]
	Parameter SYSCLK_FREQUENCY_HZ bound to: 100000000 - type: integer 
	Parameter CLOCK_CNT_100US bound to: 10000 - type: integer 
	Parameter CLOCK_CNT_20US bound to: 2000 - type: integer 
	Parameter DEBOUNCE_DELAY bound to: 15 - type: integer 
	Parameter BITS_NUM bound to: 11 - type: integer 
	Parameter parity_table bound to: 256'b1001011001101001011010011001011001101001100101101001011001101001011010011001011010010110011010011001011001101001011010011001011001101001100101101001011001101001100101100110100101101001100101101001011001101001011010011001011001101001100101101001011001101001 
	Parameter IDLE bound to: 4'b0000 
	Parameter RX_NEG_EDGE bound to: 4'b0001 
	Parameter RX_CLK_LOW bound to: 4'b0010 
	Parameter RX_CLK_HIGH bound to: 4'b0011 
	Parameter TX_FORCE_CLK_LOW bound to: 4'b0100 
	Parameter TX_BRING_DATA_LOW bound to: 4'b0101 
	Parameter TX_RELEASE_CLK bound to: 4'b0110 
	Parameter TX_WAIT_FIRTS_NEG_EDGE bound to: 4'b0111 
	Parameter TX_CLK_LOW bound to: 4'b1000 
	Parameter TX_WAIT_POS_EDGE bound to: 4'b1001 
	Parameter TX_CLK_HIGH bound to: 4'b1010 
	Parameter TX_WAIT_POS_EDGE_BEFORE_ACK bound to: 4'b1011 
	Parameter TX_WAIT_ACK bound to: 4'b1100 
	Parameter TX_RECEIVED_ACK bound to: 4'b1101 
	Parameter TX_ERROR_NO_ACK bound to: 4'b1110 
INFO: [Synth 8-6157] synthesizing module 'IOBUF' [E:/vivado/Vivado/2019.2/scripts/rt/data/unisim_comp.v:36196]
	Parameter DRIVE bound to: 12 - type: integer 
	Parameter IBUF_LOW_PWR bound to: TRUE - type: string 
	Parameter IOSTANDARD bound to: DEFAULT - type: string 
	Parameter SLEW bound to: SLOW - type: string 
INFO: [Synth 8-6155] done synthesizing module 'IOBUF' (5#1) [E:/vivado/Vivado/2019.2/scripts/rt/data/unisim_comp.v:36196]
INFO: [Synth 8-6155] done synthesizing module 'Ps2Interface' (6#1) [C:/Users/jaylu/Desktop/Ethan/HardwareDesign_finalproject/Hardware_Design_Lab_Final_Project/ip/Keyboard-Controller/keyboard_cntr_1.0/src/Ps2Interface.v:164]
INFO: [Synth 8-6155] done synthesizing module 'KeyboardCtrl' (7#1) [C:/Users/jaylu/Desktop/Ethan/HardwareDesign_finalproject/Hardware_Design_Lab_Final_Project/ip/Keyboard-Controller/keyboard_cntr_1.0/src/KeyboardCtrl.v:1]
INFO: [Synth 8-226] default block is never used [C:/Users/jaylu/Desktop/Ethan/HardwareDesign_finalproject/Hardware_Design_Lab_Final_Project/KeyboardDecoder.v:64]
INFO: [Synth 8-6155] done synthesizing module 'KeyboardDecoder' (8#1) [C:/Users/jaylu/Desktop/Ethan/HardwareDesign_finalproject/Hardware_Design_Lab_Final_Project/KeyboardDecoder.v:1]
INFO: [Synth 8-6157] synthesizing module 'dino_logic' [C:/Users/jaylu/Desktop/Ethan/HardwareDesign_finalproject/Hardware_Design_Lab_Final_Project/dino_logic.v:1]
	Parameter GROUND_Y bound to: 350 - type: integer 
	Parameter DINO_X bound to: 80 - type: integer 
	Parameter DINO_W bound to: 18 - type: integer 
	Parameter DINO_H bound to: 18 - type: integer 
	Parameter CACTUS_H bound to: 20 - type: integer 
	Parameter CACTUS_S_W bound to: 27 - type: integer 
	Parameter CACTUS_S_H bound to: 15 - type: integer 
	Parameter CACTUS_B_W bound to: 31 - type: integer 
	Parameter CACTUS_B_H bound to: 20 - type: integer 
	Parameter PTERO_W bound to: 18 - type: integer 
	Parameter PTERO_H bound to: 17 - type: integer 
	Parameter S_IDLE bound to: 2'b00 
	Parameter S_RUN bound to: 2'b01 
	Parameter S_OVER bound to: 2'b10 
	Parameter IMG_WIDTH bound to: 481 - type: integer 
	Parameter SP_DINO_JUMP bound to: 16 - type: integer 
	Parameter SP_DINO_RUN1 bound to: 268 - type: integer 
	Parameter SP_DINO_RUN2 bound to: 285 - type: integer 
	Parameter SP_CACTUS bound to: 106 - type: integer 
	Parameter SP_GAMEOVER bound to: 200 - type: integer 
	Parameter SP_PTERO bound to: 52 - type: integer 
	Parameter SP_CACTUS_B bound to: 139 - type: integer 
	Parameter SP_CACTUS_S bound to: 89 - type: integer 
INFO: [Synth 8-6157] synthesizing module 'LFSR' [C:/Users/jaylu/Desktop/Ethan/HardwareDesign_finalproject/Hardware_Design_Lab_Final_Project/LFSR.v:1]
INFO: [Synth 8-6155] done synthesizing module 'LFSR' (9#1) [C:/Users/jaylu/Desktop/Ethan/HardwareDesign_finalproject/Hardware_Design_Lab_Final_Project/LFSR.v:1]
INFO: [Synth 8-155] case statement is not full and has no default [C:/Users/jaylu/Desktop/Ethan/HardwareDesign_finalproject/Hardware_Design_Lab_Final_Project/dino_logic.v:96]
INFO: [Synth 8-6157] synthesizing module 'blk_mem_gen_0' [C:/Users/jaylu/Desktop/Ethan/HardwareDesign_finalproject/Hardware_Design_Lab_Final_Project/Final_Project/Final_Project.runs/synth_1/.Xil/Vivado-26424-DESKTOP-LCS45AM/realtime/blk_mem_gen_0_stub.v:6]
INFO: [Synth 8-6155] done synthesizing module 'blk_mem_gen_0' (10#1) [C:/Users/jaylu/Desktop/Ethan/HardwareDesign_finalproject/Hardware_Design_Lab_Final_Project/Final_Project/Final_Project.runs/synth_1/.Xil/Vivado-26424-DESKTOP-LCS45AM/realtime/blk_mem_gen_0_stub.v:6]
WARNING: [Synth 8-689] width (17) of port connection 'addra' does not match port width (14) of module 'blk_mem_gen_0' [C:/Users/jaylu/Desktop/Ethan/HardwareDesign_finalproject/Hardware_Design_Lab_Final_Project/dino_logic.v:195]
WARNING: [Synth 8-689] width (12) of port connection 'douta' does not match port width (24) of module 'blk_mem_gen_0' [C:/Users/jaylu/Desktop/Ethan/HardwareDesign_finalproject/Hardware_Design_Lab_Final_Project/dino_logic.v:196]
WARNING: [Synth 8-7023] instance 'sprite_rom' of module 'blk_mem_gen_0' has 5 connections declared, but only 3 given [C:/Users/jaylu/Desktop/Ethan/HardwareDesign_finalproject/Hardware_Design_Lab_Final_Project/dino_logic.v:193]
WARNING: [Synth 8-6014] Unused sequential element cactus_type_reg[0] was removed.  [C:/Users/jaylu/Desktop/Ethan/HardwareDesign_finalproject/Hardware_Design_Lab_Final_Project/dino_logic.v:86]
WARNING: [Synth 8-6014] Unused sequential element cactus_type_reg[1] was removed.  [C:/Users/jaylu/Desktop/Ethan/HardwareDesign_finalproject/Hardware_Design_Lab_Final_Project/dino_logic.v:86]
WARNING: [Synth 8-6014] Unused sequential element cactus_type_reg[2] was removed.  [C:/Users/jaylu/Desktop/Ethan/HardwareDesign_finalproject/Hardware_Design_Lab_Final_Project/dino_logic.v:86]
WARNING: [Synth 8-6014] Unused sequential element prev_key_valid_reg was removed.  [C:/Users/jaylu/Desktop/Ethan/HardwareDesign_finalproject/Hardware_Design_Lab_Final_Project/dino_logic.v:57]
WARNING: [Synth 8-6014] Unused sequential element last_key_reg was removed.  [C:/Users/jaylu/Desktop/Ethan/HardwareDesign_finalproject/Hardware_Design_Lab_Final_Project/dino_logic.v:57]
WARNING: [Synth 8-5788] Register cactus_x_reg[1] in module dino_logic is has both Set and reset with same priority. This may cause simulation mismatches. Consider rewriting code  [C:/Users/jaylu/Desktop/Ethan/HardwareDesign_finalproject/Hardware_Design_Lab_Final_Project/dino_logic.v:66]
WARNING: [Synth 8-5788] Register cactus_x_reg[2] in module dino_logic is has both Set and reset with same priority. This may cause simulation mismatches. Consider rewriting code  [C:/Users/jaylu/Desktop/Ethan/HardwareDesign_finalproject/Hardware_Design_Lab_Final_Project/dino_logic.v:66]
WARNING: [Synth 8-5788] Register jumped_reg in module dino_logic is has both Set and reset with same priority. This may cause simulation mismatches. Consider rewriting code  [C:/Users/jaylu/Desktop/Ethan/HardwareDesign_finalproject/Hardware_Design_Lab_Final_Project/dino_logic.v:156]
INFO: [Synth 8-6155] done synthesizing module 'dino_logic' (11#1) [C:/Users/jaylu/Desktop/Ethan/HardwareDesign_finalproject/Hardware_Design_Lab_Final_Project/dino_logic.v:1]
INFO: [Synth 8-6157] synthesizing module 'SevenSegment' [C:/Users/jaylu/Desktop/Ethan/HardwareDesign_finalproject/Hardware_Design_Lab_Final_Project/SevenSegment.v:1]
INFO: [Synth 8-6155] done synthesizing module 'SevenSegment' (12#1) [C:/Users/jaylu/Desktop/Ethan/HardwareDesign_finalproject/Hardware_Design_Lab_Final_Project/SevenSegment.v:1]
INFO: [Synth 8-6155] done synthesizing module 'dino_top' (13#1) [C:/Users/jaylu/Desktop/Ethan/HardwareDesign_finalproject/Hardware_Design_Lab_Final_Project/dino_top.v:1]
WARNING: [Synth 8-3331] design dino_logic has unconnected port key_down[511]
WARNING: [Synth 8-3331] design dino_logic has unconnected port key_down[510]
WARNING: [Synth 8-3331] design dino_logic has unconnected port key_down[509]
WARNING: [Synth 8-3331] design dino_logic has unconnected port key_down[508]
WARNING: [Synth 8-3331] design dino_logic has unconnected port key_down[507]
WARNING: [Synth 8-3331] design dino_logic has unconnected port key_down[506]
WARNING: [Synth 8-3331] design dino_logic has unconnected port key_down[505]
WARNING: [Synth 8-3331] design dino_logic has unconnected port key_down[504]
WARNING: [Synth 8-3331] design dino_logic has unconnected port key_down[503]
WARNING: [Synth 8-3331] design dino_logic has unconnected port key_down[502]
WARNING: [Synth 8-3331] design dino_logic has unconnected port key_down[501]
WARNING: [Synth 8-3331] design dino_logic has unconnected port key_down[500]
WARNING: [Synth 8-3331] design dino_logic has unconnected port key_down[499]
WARNING: [Synth 8-3331] design dino_logic has unconnected port key_down[498]
WARNING: [Synth 8-3331] design dino_logic has unconnected port key_down[497]
WARNING: [Synth 8-3331] design dino_logic has unconnected port key_down[496]
WARNING: [Synth 8-3331] design dino_logic has unconnected port key_down[495]
WARNING: [Synth 8-3331] design dino_logic has unconnected port key_down[494]
WARNING: [Synth 8-3331] design dino_logic has unconnected port key_down[493]
WARNING: [Synth 8-3331] design dino_logic has unconnected port key_down[492]
WARNING: [Synth 8-3331] design dino_logic has unconnected port key_down[491]
WARNING: [Synth 8-3331] design dino_logic has unconnected port key_down[490]
WARNING: [Synth 8-3331] design dino_logic has unconnected port key_down[489]
WARNING: [Synth 8-3331] design dino_logic has unconnected port key_down[488]
WARNING: [Synth 8-3331] design dino_logic has unconnected port key_down[487]
WARNING: [Synth 8-3331] design dino_logic has unconnected port key_down[486]
WARNING: [Synth 8-3331] design dino_logic has unconnected port key_down[485]
WARNING: [Synth 8-3331] design dino_logic has unconnected port key_down[484]
WARNING: [Synth 8-3331] design dino_logic has unconnected port key_down[483]
WARNING: [Synth 8-3331] design dino_logic has unconnected port key_down[482]
WARNING: [Synth 8-3331] design dino_logic has unconnected port key_down[481]
WARNING: [Synth 8-3331] design dino_logic has unconnected port key_down[480]
WARNING: [Synth 8-3331] design dino_logic has unconnected port key_down[479]
WARNING: [Synth 8-3331] design dino_logic has unconnected port key_down[478]
WARNING: [Synth 8-3331] design dino_logic has unconnected port key_down[477]
WARNING: [Synth 8-3331] design dino_logic has unconnected port key_down[476]
WARNING: [Synth 8-3331] design dino_logic has unconnected port key_down[475]
WARNING: [Synth 8-3331] design dino_logic has unconnected port key_down[474]
WARNING: [Synth 8-3331] design dino_logic has unconnected port key_down[473]
WARNING: [Synth 8-3331] design dino_logic has unconnected port key_down[472]
WARNING: [Synth 8-3331] design dino_logic has unconnected port key_down[471]
WARNING: [Synth 8-3331] design dino_logic has unconnected port key_down[470]
WARNING: [Synth 8-3331] design dino_logic has unconnected port key_down[469]
WARNING: [Synth 8-3331] design dino_logic has unconnected port key_down[468]
WARNING: [Synth 8-3331] design dino_logic has unconnected port key_down[467]
WARNING: [Synth 8-3331] design dino_logic has unconnected port key_down[466]
WARNING: [Synth 8-3331] design dino_logic has unconnected port key_down[465]
WARNING: [Synth 8-3331] design dino_logic has unconnected port key_down[464]
WARNING: [Synth 8-3331] design dino_logic has unconnected port key_down[463]
WARNING: [Synth 8-3331] design dino_logic has unconnected port key_down[462]
WARNING: [Synth 8-3331] design dino_logic has unconnected port key_down[461]
WARNING: [Synth 8-3331] design dino_logic has unconnected port key_down[460]
WARNING: [Synth 8-3331] design dino_logic has unconnected port key_down[459]
WARNING: [Synth 8-3331] design dino_logic has unconnected port key_down[458]
WARNING: [Synth 8-3331] design dino_logic has unconnected port key_down[457]
WARNING: [Synth 8-3331] design dino_logic has unconnected port key_down[456]
WARNING: [Synth 8-3331] design dino_logic has unconnected port key_down[455]
WARNING: [Synth 8-3331] design dino_logic has unconnected port key_down[454]
WARNING: [Synth 8-3331] design dino_logic has unconnected port key_down[453]
WARNING: [Synth 8-3331] design dino_logic has unconnected port key_down[452]
WARNING: [Synth 8-3331] design dino_logic has unconnected port key_down[451]
WARNING: [Synth 8-3331] design dino_logic has unconnected port key_down[450]
WARNING: [Synth 8-3331] design dino_logic has unconnected port key_down[449]
WARNING: [Synth 8-3331] design dino_logic has unconnected port key_down[448]
WARNING: [Synth 8-3331] design dino_logic has unconnected port key_down[447]
WARNING: [Synth 8-3331] design dino_logic has unconnected port key_down[446]
WARNING: [Synth 8-3331] design dino_logic has unconnected port key_down[445]
WARNING: [Synth 8-3331] design dino_logic has unconnected port key_down[444]
WARNING: [Synth 8-3331] design dino_logic has unconnected port key_down[443]
WARNING: [Synth 8-3331] design dino_logic has unconnected port key_down[442]
WARNING: [Synth 8-3331] design dino_logic has unconnected port key_down[441]
WARNING: [Synth 8-3331] design dino_logic has unconnected port key_down[440]
WARNING: [Synth 8-3331] design dino_logic has unconnected port key_down[439]
WARNING: [Synth 8-3331] design dino_logic has unconnected port key_down[438]
WARNING: [Synth 8-3331] design dino_logic has unconnected port key_down[437]
WARNING: [Synth 8-3331] design dino_logic has unconnected port key_down[436]
WARNING: [Synth 8-3331] design dino_logic has unconnected port key_down[435]
WARNING: [Synth 8-3331] design dino_logic has unconnected port key_down[434]
WARNING: [Synth 8-3331] design dino_logic has unconnected port key_down[433]
WARNING: [Synth 8-3331] design dino_logic has unconnected port key_down[432]
WARNING: [Synth 8-3331] design dino_logic has unconnected port key_down[431]
WARNING: [Synth 8-3331] design dino_logic has unconnected port key_down[430]
WARNING: [Synth 8-3331] design dino_logic has unconnected port key_down[429]
WARNING: [Synth 8-3331] design dino_logic has unconnected port key_down[428]
WARNING: [Synth 8-3331] design dino_logic has unconnected port key_down[427]
WARNING: [Synth 8-3331] design dino_logic has unconnected port key_down[426]
WARNING: [Synth 8-3331] design dino_logic has unconnected port key_down[425]
WARNING: [Synth 8-3331] design dino_logic has unconnected port key_down[424]
WARNING: [Synth 8-3331] design dino_logic has unconnected port key_down[423]
WARNING: [Synth 8-3331] design dino_logic has unconnected port key_down[422]
WARNING: [Synth 8-3331] design dino_logic has unconnected port key_down[421]
WARNING: [Synth 8-3331] design dino_logic has unconnected port key_down[420]
WARNING: [Synth 8-3331] design dino_logic has unconnected port key_down[419]
WARNING: [Synth 8-3331] design dino_logic has unconnected port key_down[418]
WARNING: [Synth 8-3331] design dino_logic has unconnected port key_down[417]
WARNING: [Synth 8-3331] design dino_logic has unconnected port key_down[416]
WARNING: [Synth 8-3331] design dino_logic has unconnected port key_down[415]
WARNING: [Synth 8-3331] design dino_logic has unconnected port key_down[414]
WARNING: [Synth 8-3331] design dino_logic has unconnected port key_down[413]
WARNING: [Synth 8-3331] design dino_logic has unconnected port key_down[412]
INFO: [Common 17-14] Message 'Synth 8-3331' appears 100 times and further instances of the messages will be disabled. Use the Tcl command set_msg_config to change the current settings.
---------------------------------------------------------------------------------
Finished RTL Elaboration : Time (s): cpu = 00:00:04 ; elapsed = 00:00:05 . Memory (MB): peak = 841.250 ; gain = 296.719
---------------------------------------------------------------------------------

Report Check Netlist: 
+------+------------------+-------+---------+-------+------------------+
|      |Item              |Errors |Warnings |Status |Description       |
+------+------------------+-------+---------+-------+------------------+
|1     |multi_driven_nets |      0|        0|Passed |Multi driven nets |
+------+------------------+-------+---------+-------+------------------+
---------------------------------------------------------------------------------
Start Handling Custom Attributes
---------------------------------------------------------------------------------
---------------------------------------------------------------------------------
Finished Handling Custom Attributes : Time (s): cpu = 00:00:05 ; elapsed = 00:00:05 . Memory (MB): peak = 841.250 ; gain = 296.719
---------------------------------------------------------------------------------
---------------------------------------------------------------------------------
Finished RTL Optimization Phase 1 : Time (s): cpu = 00:00:05 ; elapsed = 00:00:05 . Memory (MB): peak = 841.250 ; gain = 296.719
---------------------------------------------------------------------------------
Netlist sorting complete. Time (s): cpu = 00:00:00 ; elapsed = 00:00:00.045 . Memory (MB): peak = 841.250 ; gain = 0.000
INFO: [Netlist 29-17] Analyzing 2 Unisim elements for replacement
INFO: [Netlist 29-28] Unisim Transformation completed in 0 CPU seconds
INFO: [Project 1-570] Preparing netlist for logic optimization

Processing XDC Constraints
Initializing timing engine
Parsing XDC File [c:/Users/jaylu/Desktop/Ethan/HardwareDesign_finalproject/Hardware_Design_Lab_Final_Project/Final_Project/Final_Project.srcs/sources_1/ip/blk_mem_gen_0/blk_mem_gen_0/blk_mem_gen_0_in_context.xdc] for cell 'game_inst/sprite_rom'
Finished Parsing XDC File [c:/Users/jaylu/Desktop/Ethan/HardwareDesign_finalproject/Hardware_Design_Lab_Final_Project/Final_Project/Final_Project.srcs/sources_1/ip/blk_mem_gen_0/blk_mem_gen_0/blk_mem_gen_0_in_context.xdc] for cell 'game_inst/sprite_rom'
Parsing XDC File [C:/Users/jaylu/Desktop/Ethan/HardwareDesign_finalproject/Hardware_Design_Lab_Final_Project/Final_Project.xdc]
Finished Parsing XDC File [C:/Users/jaylu/Desktop/Ethan/HardwareDesign_finalproject/Hardware_Design_Lab_Final_Project/Final_Project.xdc]
INFO: [Project 1-236] Implementation specific constraints were found while reading constraint file [C:/Users/jaylu/Desktop/Ethan/HardwareDesign_finalproject/Hardware_Design_Lab_Final_Project/Final_Project.xdc]. These constraints will be ignored for synthesis but will be used in implementation. Impacted constraints are listed in the file [.Xil/dino_top_propImpl.xdc].
Resolution: To avoid this warning, move constraints listed in [.Xil/dino_top_propImpl.xdc] to another XDC file and exclude this new file from synthesis with the used_in_synthesis property (File Properties dialog in GUI) and re-run elaboration/synthesis.
Completed Processing XDC Constraints

Netlist sorting complete. Time (s): cpu = 00:00:00 ; elapsed = 00:00:00.001 . Memory (MB): peak = 963.527 ; gain = 0.000
INFO: [Project 1-111] Unisim Transformation Summary:
  A total of 2 instances were transformed.
  IOBUF => IOBUF (IBUF, OBUFT): 2 instances

Constraint Validation Runtime : Time (s): cpu = 00:00:00 ; elapsed = 00:00:00.008 . Memory (MB): peak = 963.527 ; gain = 0.000
---------------------------------------------------------------------------------
Finished Constraint Validation : Time (s): cpu = 00:00:11 ; elapsed = 00:00:11 . Memory (MB): peak = 963.527 ; gain = 418.996
---------------------------------------------------------------------------------
---------------------------------------------------------------------------------
Start Loading Part and Timing Information
---------------------------------------------------------------------------------
Loading part: xc7a35tcpg236-1
---------------------------------------------------------------------------------
Finished Loading Part and Timing Information : Time (s): cpu = 00:00:11 ; elapsed = 00:00:11 . Memory (MB): peak = 963.527 ; gain = 418.996
---------------------------------------------------------------------------------
---------------------------------------------------------------------------------
Start Applying 'set_property' XDC Constraints
---------------------------------------------------------------------------------
Applied set_property DONT_TOUCH = true for game_inst/sprite_rom. (constraint file  auto generated constraint, line ).
---------------------------------------------------------------------------------
Finished applying 'set_property' XDC Constraints : Time (s): cpu = 00:00:11 ; elapsed = 00:00:11 . Memory (MB): peak = 963.527 ; gain = 418.996
---------------------------------------------------------------------------------
INFO: [Synth 8-802] inferred FSM for state register 'state_reg' in module 'Ps2Interface'
INFO: [Synth 8-5544] ROM "ps2_clk_out_next" won't be mapped to Block RAM because address size (4) smaller than threshold (5)
INFO: [Synth 8-5544] ROM "ps2_clk_en_next" won't be mapped to Block RAM because address size (4) smaller than threshold (5)
INFO: [Synth 8-802] inferred FSM for state register 'state_reg' in module 'KeyboardCtrl'
INFO: [Synth 8-802] inferred FSM for state register 'state_reg' in module 'KeyboardDecoder'
INFO: [Synth 8-802] inferred FSM for state register 'state_reg' in module 'dino_logic'
INFO: [Synth 8-802] inferred FSM for state register 'digit_reg' in module 'SevenSegment'
INFO: [Synth 8-5544] ROM "digit" won't be mapped to Block RAM because address size (4) smaller than threshold (5)
---------------------------------------------------------------------------------------------------
                   State |                     New Encoding |                Previous Encoding 
---------------------------------------------------------------------------------------------------
                    IDLE |                  000000000000010 |                             0000
        TX_FORCE_CLK_LOW |                  000000000001000 |                             0100
       TX_BRING_DATA_LOW |                  000000000010000 |                             0101
          TX_RELEASE_CLK |                  100000000000000 |                             0110
  TX_WAIT_FIRTS_NEG_EDGE |                  001000000000000 |                             0111
              TX_CLK_LOW |                  000100000000000 |                             1000
        TX_WAIT_POS_EDGE |                  010000000000000 |                             1001
TX_WAIT_POS_EDGE_BEFORE_ACK |                  000001000000000 |                             1011
             TX_WAIT_ACK |                  000000010000000 |                             1100
         TX_RECEIVED_ACK |                  000000000100000 |                             1101
         TX_ERROR_NO_ACK |                  000000100000000 |                             1110
             TX_CLK_HIGH |                  000010000000000 |                             1010
             RX_NEG_EDGE |                  000000000000100 |                             0001
              RX_CLK_LOW |                  000000001000000 |                             0010
             RX_CLK_HIGH |                  000000000000001 |                             0011
---------------------------------------------------------------------------------------------------
INFO: [Synth 8-3354] encoded FSM with state register 'state_reg' using encoding 'one-hot' in module 'Ps2Interface'
---------------------------------------------------------------------------------------------------
                   State |                     New Encoding |                Previous Encoding 
---------------------------------------------------------------------------------------------------
                   RESET |                              000 |                              000
                SEND_CMD |                              001 |                              001
                WAIT_ACK |                              010 |                              010
          RESET_WAIT_BAT |                              011 |                              110
              WAIT_KEYIN |                              100 |                              011
              GET_EXTEND |                              101 |                              101
               GET_BREAK |                              110 |                              100
---------------------------------------------------------------------------------------------------
INFO: [Synth 8-3354] encoded FSM with state register 'state_reg' using encoding 'sequential' in module 'KeyboardCtrl'
---------------------------------------------------------------------------------------------------
                   State |                     New Encoding |                Previous Encoding 
---------------------------------------------------------------------------------------------------
                    INIT |                               00 |                               00
         WAIT_FOR_SIGNAL |                               01 |                               01
         GET_SIGNAL_DOWN |                               10 |                               10
            WAIT_RELEASE |                               11 |                               11
---------------------------------------------------------------------------------------------------
INFO: [Synth 8-3354] encoded FSM with state register 'state_reg' using encoding 'sequential' in module 'KeyboardDecoder'
---------------------------------------------------------------------------------------------------
                   State |                     New Encoding |                Previous Encoding 
---------------------------------------------------------------------------------------------------
                  S_IDLE |                              001 |                               00
                   S_RUN |                              010 |                               01
                  S_OVER |                              100 |                               10
---------------------------------------------------------------------------------------------------
INFO: [Synth 8-3354] encoded FSM with state register 'state_reg' using encoding 'one-hot' in module 'dino_logic'
---------------------------------------------------------------------------------------------------
                   State |                     New Encoding |                Previous Encoding 
---------------------------------------------------------------------------------------------------
                 iSTATE3 |                              000 |                             1111
*
                  iSTATE |                              001 |                             1110
                 iSTATE0 |                              010 |                             1101
                 iSTATE1 |                              011 |                             1011
                 iSTATE2 |                              100 |                             0111
---------------------------------------------------------------------------------------------------
INFO: [Synth 8-3354] encoded FSM with state register 'digit_reg' using encoding 'sequential' in module 'SevenSegment'
---------------------------------------------------------------------------------
Finished RTL Optimization Phase 2 : Time (s): cpu = 00:00:12 ; elapsed = 00:00:12 . Memory (MB): peak = 963.527 ; gain = 418.996
---------------------------------------------------------------------------------

Report RTL Partitions: 
+-+--------------+------------+----------+
| |RTL Partition |Replication |Instances |
+-+--------------+------------+----------+
+-+--------------+------------+----------+
---------------------------------------------------------------------------------
Start RTL Component Statistics 
---------------------------------------------------------------------------------
Detailed RTL Component Info : 
+---Adders : 
	   2 Input     32 Bit       Adders := 1     
	   3 Input     15 Bit       Adders := 3     
	   2 Input     14 Bit       Adders := 4     
	   3 Input     13 Bit       Adders := 3     
	   2 Input     11 Bit       Adders := 1     
	   2 Input     10 Bit       Adders := 9     
	   3 Input     10 Bit       Adders := 4     
	   2 Input      6 Bit       Adders := 1     
	   2 Input      4 Bit       Adders := 7     
	   2 Input      3 Bit       Adders := 1     
	   2 Input      2 Bit       Adders := 1     
+---XORs : 
	   4 Input      1 Bit         XORs := 1     
+---Registers : 
	              512 Bit    Registers := 1     
	               32 Bit    Registers := 1     
	               14 Bit    Registers := 1     
	               13 Bit    Registers := 3     
	               11 Bit    Registers := 1     
	               10 Bit    Registers := 8     
	                8 Bit    Registers := 3     
	                7 Bit    Registers := 2     
	                6 Bit    Registers := 1     
	                4 Bit    Registers := 8     
	                3 Bit    Registers := 2     
	                2 Bit    Registers := 2     
	                1 Bit    Registers := 27    
+---Muxes : 
	   2 Input    512 Bit        Muxes := 1     
	  15 Input     15 Bit        Muxes := 1     
	   2 Input     15 Bit        Muxes := 17    
	   2 Input     14 Bit        Muxes := 3     
	  15 Input     14 Bit        Muxes := 1     
	   2 Input     13 Bit        Muxes := 11    
	   3 Input     13 Bit        Muxes := 1     
	   3 Input     12 Bit        Muxes := 1     
	   2 Input     11 Bit        Muxes := 1     
	   2 Input     10 Bit        Muxes := 10    
	   4 Input     10 Bit        Muxes := 1     
	   3 Input     10 Bit        Muxes := 1     
	   4 Input      9 Bit        Muxes := 1     
	   7 Input      8 Bit        Muxes := 1     
	   2 Input      6 Bit        Muxes := 1     
	   2 Input      5 Bit        Muxes := 1     
	   2 Input      4 Bit        Muxes := 11    
	   5 Input      4 Bit        Muxes := 2     
	  25 Input      3 Bit        Muxes := 1     
	   2 Input      3 Bit        Muxes := 6     
	   3 Input      3 Bit        Muxes := 1     
	   5 Input      3 Bit        Muxes := 1     
	   4 Input      2 Bit        Muxes := 1     
	   2 Input      2 Bit        Muxes := 6     
	   2 Input      1 Bit        Muxes := 53    
	  15 Input      1 Bit        Muxes := 6     
	   7 Input      1 Bit        Muxes := 7     
	   4 Input      1 Bit        Muxes := 7     
	   3 Input      1 Bit        Muxes := 4     
	   5 Input      1 Bit        Muxes := 1     
---------------------------------------------------------------------------------
Finished RTL Component Statistics 
---------------------------------------------------------------------------------
---------------------------------------------------------------------------------
Start RTL Hierarchical Component Statistics 
---------------------------------------------------------------------------------
Hierarchical RTL Component report 
Module dino_top 
Detailed RTL Component Info : 
+---Adders : 
	   2 Input      6 Bit       Adders := 1     
	   2 Input      4 Bit       Adders := 4     
+---Registers : 
	                6 Bit    Registers := 1     
	                4 Bit    Registers := 4     
	                1 Bit    Registers := 1     
+---Muxes : 
	   2 Input      6 Bit        Muxes := 1     
	   2 Input      4 Bit        Muxes := 6     
	   2 Input      1 Bit        Muxes := 5     
	   5 Input      1 Bit        Muxes := 1     
Module clock_divider 
Detailed RTL Component Info : 
+---Adders : 
	   2 Input      2 Bit       Adders := 1     
+---Registers : 
	                2 Bit    Registers := 1     
Module vga_controller 
Detailed RTL Component Info : 
+---Adders : 
	   2 Input     10 Bit       Adders := 2     
+---Registers : 
	               10 Bit    Registers := 2     
	                1 Bit    Registers := 2     
+---Muxes : 
	   2 Input     10 Bit        Muxes := 2     
	   2 Input      1 Bit        Muxes := 2     
Module debounce 
Detailed RTL Component Info : 
+---Registers : 
	                7 Bit    Registers := 1     
+---Muxes : 
	   2 Input      1 Bit        Muxes := 1     
Module one_pulse 
Detailed RTL Component Info : 
+---Registers : 
	                1 Bit    Registers := 2     
Module Ps2Interface 
Detailed RTL Component Info : 
+---Adders : 
	   2 Input     14 Bit       Adders := 1     
	   2 Input      4 Bit       Adders := 3     
+---Registers : 
	               14 Bit    Registers := 1     
	               11 Bit    Registers := 1     
	                8 Bit    Registers := 1     
	                4 Bit    Registers := 3     
	                1 Bit    Registers := 10    
+---Muxes : 
	  15 Input     15 Bit        Muxes := 1     
	   2 Input     15 Bit        Muxes := 17    
	   2 Input     14 Bit        Muxes := 3     
	  15 Input     14 Bit        Muxes := 1     
	   2 Input     11 Bit        Muxes := 1     
	   2 Input      4 Bit        Muxes := 5     
	   2 Input      1 Bit        Muxes := 8     
	  15 Input      1 Bit        Muxes := 6     
Module KeyboardCtrl 
Detailed RTL Component Info : 
+---Registers : 
	                8 Bit    Registers := 2     
	                3 Bit    Registers := 1     
	                1 Bit    Registers := 4     
+---Muxes : 
	   7 Input      8 Bit        Muxes := 1     
	  25 Input      3 Bit        Muxes := 1     
	   2 Input      1 Bit        Muxes := 1     
	   7 Input      1 Bit        Muxes := 7     
Module KeyboardDecoder 
Detailed RTL Component Info : 
+---Registers : 
	              512 Bit    Registers := 1     
	               10 Bit    Registers := 1     
	                1 Bit    Registers := 4     
+---Muxes : 
	   2 Input    512 Bit        Muxes := 1     
	   4 Input     10 Bit        Muxes := 1     
	   4 Input      2 Bit        Muxes := 1     
	   2 Input      2 Bit        Muxes := 3     
	   2 Input      1 Bit        Muxes := 8     
	   4 Input      1 Bit        Muxes := 7     
Module LFSR 
Detailed RTL Component Info : 
+---XORs : 
	   4 Input      1 Bit         XORs := 1     
+---Registers : 
	               32 Bit    Registers := 1     
	               10 Bit    Registers := 1     
Module dino_logic 
Detailed RTL Component Info : 
+---Adders : 
	   2 Input     32 Bit       Adders := 1     
	   3 Input     15 Bit       Adders := 3     
	   2 Input     14 Bit       Adders := 3     
	   3 Input     13 Bit       Adders := 3     
	   2 Input     11 Bit       Adders := 1     
	   2 Input     10 Bit       Adders := 7     
	   3 Input     10 Bit       Adders := 4     
	   2 Input      3 Bit       Adders := 1     
+---Registers : 
	               13 Bit    Registers := 3     
	               10 Bit    Registers := 4     
	                3 Bit    Registers := 1     
	                2 Bit    Registers := 1     
	                1 Bit    Registers := 2     
+---Muxes : 
	   2 Input     13 Bit        Muxes := 11    
	   3 Input     13 Bit        Muxes := 1     
	   3 Input     12 Bit        Muxes := 1     
	   2 Input     10 Bit        Muxes := 8     
	   3 Input     10 Bit        Muxes := 1     
	   4 Input      9 Bit        Muxes := 1     
	   2 Input      5 Bit        Muxes := 1     
	   2 Input      3 Bit        Muxes := 6     
	   3 Input      3 Bit        Muxes := 1     
	   2 Input      2 Bit        Muxes := 3     
	   2 Input      1 Bit        Muxes := 27    
	   3 Input      1 Bit        Muxes := 4     
Module SevenSegment 
Detailed RTL Component Info : 
+---Registers : 
	                4 Bit    Registers := 1     
+---Muxes : 
	   5 Input      4 Bit        Muxes := 2     
	   5 Input      3 Bit        Muxes := 1     
---------------------------------------------------------------------------------
Finished RTL Hierarchical Component Statistics
---------------------------------------------------------------------------------
---------------------------------------------------------------------------------
Start Part Resource Summary
---------------------------------------------------------------------------------
Part Resources:
DSPs: 90 (col length:60)
BRAMs: 100 (col length: RAMB18 60 RAMB36 30)
---------------------------------------------------------------------------------
Finished Part Resource Summary
---------------------------------------------------------------------------------
---------------------------------------------------------------------------------
Start Cross Boundary and Area Optimization
---------------------------------------------------------------------------------
Warning: Parallel synthesis criteria is not met 
DSP Report: Generating DSP sprite_addr1, operation Mode is: A*(B:0x1e1).
DSP Report: operator sprite_addr1 is absorbed into DSP sprite_addr1.
DSP Report: Generating DSP sprite_addr0, operation Mode is: PCIN+(A:0x0):B+C.
DSP Report: operator sprite_addr0 is absorbed into DSP sprite_addr0.
DSP Report: Generating DSP sprite_addr1, operation Mode is: A*(B:0x1e1).
DSP Report: operator sprite_addr1 is absorbed into DSP sprite_addr1.
DSP Report: Generating DSP sprite_addr0, operation Mode is: PCIN+(A:0x0):B+(C:0x59).
DSP Report: operator sprite_addr0 is absorbed into DSP sprite_addr0.
DSP Report: Generating DSP sprite_addr1, operation Mode is: A*(B:0x1e1).
DSP Report: operator sprite_addr1 is absorbed into DSP sprite_addr1.
DSP Report: Generating DSP sprite_addr0, operation Mode is: PCIN+(A:0x0):B+(C:0x8b).
DSP Report: operator sprite_addr0 is absorbed into DSP sprite_addr0.
DSP Report: Generating DSP sprite_addr1, operation Mode is: A*(B:0x1e1).
DSP Report: operator sprite_addr1 is absorbed into DSP sprite_addr1.
DSP Report: Generating DSP sprite_addr0, operation Mode is: PCIN+(A:0x0):B+(C:0x34).
DSP Report: operator sprite_addr0 is absorbed into DSP sprite_addr0.
INFO: [Synth 8-3886] merging instance 'game_inst/lfsr/lfsr_reg_reg[9]' (FDC) to 'game_inst/lfsr/random_out_reg[8]'
INFO: [Synth 8-3886] merging instance 'kbd_decoder/inst/lock_status_reg[2]' (FDCE) to 'kbd_decoder/inst/lock_status_reg[0]'
INFO: [Synth 8-3886] merging instance 'kbd_decoder/inst/lock_status_reg[1]' (FDCE) to 'kbd_decoder/inst/lock_status_reg[0]'
INFO: [Synth 8-3333] propagating constant 0 across sequential element (kbd_decoder/\inst/lock_status_reg[0] )
INFO: [Synth 8-3886] merging instance 'kbd_decoder/inst/tx_data_reg[6]' (FDCE) to 'kbd_decoder/inst/tx_data_reg[3]'
INFO: [Synth 8-3886] merging instance 'kbd_decoder/inst/tx_data_reg[7]' (FDCE) to 'kbd_decoder/inst/tx_data_reg[3]'
INFO: [Synth 8-3886] merging instance 'kbd_decoder/inst/tx_data_reg[5]' (FDCE) to 'kbd_decoder/inst/tx_data_reg[3]'
INFO: [Synth 8-3886] merging instance 'kbd_decoder/inst/tx_data_reg[4]' (FDCE) to 'kbd_decoder/inst/tx_data_reg[3]'
INFO: [Synth 8-3886] merging instance 'game_inst/lfsr/lfsr_reg_reg[8]' (FDC) to 'game_inst/lfsr/random_out_reg[7]'
INFO: [Synth 8-3886] merging instance 'game_inst/score_reg[0]' (FDCE) to 'game_inst/score_reg[4]'
INFO: [Synth 8-3886] merging instance 'game_inst/score_reg[1]' (FDCE) to 'game_inst/score_reg[4]'
INFO: [Synth 8-3886] merging instance 'game_inst/score_reg[2]' (FDCE) to 'game_inst/score_reg[4]'
INFO: [Synth 8-3886] merging instance 'game_inst/score_reg[4]' (FDCE) to 'game_inst/score_reg[3]'
INFO: [Synth 8-3886] merging instance 'game_inst/lfsr/lfsr_reg_reg[1]' (FDC) to 'game_inst/lfsr/random_out_reg[0]'
INFO: [Synth 8-3886] merging instance 'game_inst/lfsr/lfsr_reg_reg[2]' (FDC) to 'game_inst/lfsr/random_out_reg[1]'
INFO: [Synth 8-3886] merging instance 'game_inst/lfsr/lfsr_reg_reg[3]' (FDC) to 'game_inst/lfsr/random_out_reg[2]'
INFO: [Synth 8-3886] merging instance 'game_inst/lfsr/lfsr_reg_reg[4]' (FDC) to 'game_inst/lfsr/random_out_reg[3]'
INFO: [Synth 8-3886] merging instance 'game_inst/score_reg[5]' (FDCE) to 'game_inst/score_reg[3]'
INFO: [Synth 8-3886] merging instance 'game_inst/score_reg[6]' (FDCE) to 'game_inst/score_reg[3]'
INFO: [Synth 8-3886] merging instance 'game_inst/score_reg[7]' (FDCE) to 'game_inst/score_reg[3]'
INFO: [Synth 8-3886] merging instance 'game_inst/score_reg[8]' (FDCE) to 'game_inst/score_reg[3]'
INFO: [Synth 8-3886] merging instance 'game_inst/score_reg[9]' (FDCE) to 'game_inst/score_reg[3]'
INFO: [Synth 8-3333] propagating constant 0 across sequential element (game_inst/\score_reg[3] )
INFO: [Synth 8-3886] merging instance 'kbd_decoder/inst/tx_data_reg[2]' (FDCE) to 'kbd_decoder/inst/tx_data_reg[0]'
INFO: [Synth 8-3886] merging instance 'kbd_decoder/inst/tx_data_reg[1]' (FDCE) to 'kbd_decoder/inst/tx_data_reg[0]'
---------------------------------------------------------------------------------
Finished Cross Boundary and Area Optimization : Time (s): cpu = 00:00:17 ; elapsed = 00:00:18 . Memory (MB): peak = 963.527 ; gain = 418.996
---------------------------------------------------------------------------------
---------------------------------------------------------------------------------
Start ROM, RAM, DSP and Shift Register Reporting
---------------------------------------------------------------------------------

ROM:
+-------------+-----------------------------+---------------+----------------+
|Module Name  | RTL Object                  | Depth x Width | Implemented As | 
+-------------+-----------------------------+---------------+----------------+
|Ps2Interface | parity_table                | 256x1         | LUT            | 
|Ps2Interface | parity_table                | 256x1         | LUT            | 
|KeyboardCtrl | Ps2Interface_i/parity_table | 256x1         | LUT            | 
|KeyboardCtrl | Ps2Interface_i/parity_table | 256x1         | LUT            | 
+-------------+-----------------------------+---------------+----------------+


DSP: Preliminary Mapping	Report (see note below)
+------------+-------------------------+--------+--------+--------+--------+--------+------+------+------+------+-------+------+------+
|Module Name | DSP Mapping             | A Size | B Size | C Size | D Size | P Size | AREG | BREG | CREG | DREG | ADREG | MREG | PREG | 
+------------+-------------------------+--------+--------+--------+--------+--------+------+------+------+------+-------+------+------+
|dino_logic  | A*(B:0x1e1)             | 10     | 9      | -      | -      | 19     | 0    | 0    | -    | -    | -     | 0    | 0    | 
|dino_logic  | PCIN+(A:0x0):B+C        | 30     | 10     | 9      | -      | -1     | 0    | 0    | 0    | -    | -     | 0    | 0    | 
|dino_logic  | A*(B:0x1e1)             | 10     | 9      | -      | -      | 19     | 0    | 0    | -    | -    | -     | 0    | 0    | 
|dino_logic  | PCIN+(A:0x0):B+(C:0x59) | 30     | 10     | 7      | -      | -1     | 0    | 0    | 0    | -    | -     | 0    | 0    | 
|dino_logic  | A*(B:0x1e1)             | 10     | 9      | -      | -      | 19     | 0    | 0    | -    | -    | -     | 0    | 0    | 
|dino_logic  | PCIN+(A:0x0):B+(C:0x8b) | 30     | 10     | 8      | -      | -1     | 0    | 0    | 0    | -    | -     | 0    | 0    | 
|dino_logic  | A*(B:0x1e1)             | 10     | 9      | -      | -      | 19     | 0    | 0    | -    | -    | -     | 0    | 0    | 
|dino_logic  | PCIN+(A:0x0):B+(C:0x34) | 30     | 10     | 6      | -      | -1     | 0    | 0    | 0    | -    | -     | 0    | 0    | 
+------------+-------------------------+--------+--------+--------+--------+--------+------+------+------+------+-------+------+------+

Note: The table above is a preliminary report that shows the DSPs inferred at the current stage of the synthesis flow. Some DSP may be reimplemented as non DSP primitives later in the synthesis flow. Multiple instantiated DSPs are reported only once.
---------------------------------------------------------------------------------
Finished ROM, RAM, DSP and Shift Register Reporting
---------------------------------------------------------------------------------

Report RTL Partitions: 
+-+--------------+------------+----------+
| |RTL Partition |Replication |Instances |
+-+--------------+------------+----------+
+-+--------------+------------+----------+
---------------------------------------------------------------------------------
Start Applying XDC Timing Constraints
---------------------------------------------------------------------------------
---------------------------------------------------------------------------------
Finished Applying XDC Timing Constraints : Time (s): cpu = 00:00:27 ; elapsed = 00:00:28 . Memory (MB): peak = 982.664 ; gain = 438.133
---------------------------------------------------------------------------------
---------------------------------------------------------------------------------
Start Timing Optimization
---------------------------------------------------------------------------------
---------------------------------------------------------------------------------
Finished Timing Optimization : Time (s): cpu = 00:00:28 ; elapsed = 00:00:28 . Memory (MB): peak = 1002.797 ; gain = 458.266
---------------------------------------------------------------------------------

Report RTL Partitions: 
+-+--------------+------------+----------+
| |RTL Partition |Replication |Instances |
+-+--------------+------------+----------+
+-+--------------+------------+----------+
---------------------------------------------------------------------------------
Start Technology Mapping
---------------------------------------------------------------------------------
---------------------------------------------------------------------------------
Finished Technology Mapping : Time (s): cpu = 00:00:28 ; elapsed = 00:00:29 . Memory (MB): peak = 1024.254 ; gain = 479.723
---------------------------------------------------------------------------------

Report RTL Partitions: 
+-+--------------+------------+----------+
| |RTL Partition |Replication |Instances |
+-+--------------+------------+----------+
+-+--------------+------------+----------+
---------------------------------------------------------------------------------
Start IO Insertion
---------------------------------------------------------------------------------
---------------------------------------------------------------------------------
Start Flattening Before IO Insertion
---------------------------------------------------------------------------------
---------------------------------------------------------------------------------
Finished Flattening Before IO Insertion
---------------------------------------------------------------------------------
---------------------------------------------------------------------------------
Start Final Netlist Cleanup
---------------------------------------------------------------------------------
INFO: [Synth 8-5365] Flop kbd_decoder/inst/Ps2Interface_i/ps2_clk_en_reg is being inverted and renamed to kbd_decoder/inst/Ps2Interface_i/ps2_clk_en_reg_inv.
INFO: [Synth 8-5365] Flop kbd_decoder/inst/Ps2Interface_i/ps2_data_en_reg is being inverted and renamed to kbd_decoder/inst/Ps2Interface_i/ps2_data_en_reg_inv.
---------------------------------------------------------------------------------
Finished Final Netlist Cleanup
---------------------------------------------------------------------------------
CRITICAL WARNING: [Synth 8-4442] BlackBox module \game_inst/sprite_rom  has unconnected pin wea[0]
CRITICAL WARNING: [Synth 8-4442] BlackBox module \game_inst/sprite_rom  has unconnected pin dina[23]
CRITICAL WARNING: [Synth 8-4442] BlackBox module \game_inst/sprite_rom  has unconnected pin dina[22]
CRITICAL WARNING: [Synth 8-4442] BlackBox module \game_inst/sprite_rom  has unconnected pin dina[21]
CRITICAL WARNING: [Synth 8-4442] BlackBox module \game_inst/sprite_rom  has unconnected pin dina[20]
CRITICAL WARNING: [Synth 8-4442] BlackBox module \game_inst/sprite_rom  has unconnected pin dina[19]
CRITICAL WARNING: [Synth 8-4442] BlackBox module \game_inst/sprite_rom  has unconnected pin dina[18]
CRITICAL WARNING: [Synth 8-4442] BlackBox module \game_inst/sprite_rom  has unconnected pin dina[17]
CRITICAL WARNING: [Synth 8-4442] BlackBox module \game_inst/sprite_rom  has unconnected pin dina[16]
CRITICAL WARNING: [Synth 8-4442] BlackBox module \game_inst/sprite_rom  has unconnected pin dina[15]
CRITICAL WARNING: [Synth 8-4442] BlackBox module \game_inst/sprite_rom  has unconnected pin dina[14]
CRITICAL WARNING: [Synth 8-4442] BlackBox module \game_inst/sprite_rom  has unconnected pin dina[13]
CRITICAL WARNING: [Synth 8-4442] BlackBox module \game_inst/sprite_rom  has unconnected pin dina[12]
CRITICAL WARNING: [Synth 8-4442] BlackBox module \game_inst/sprite_rom  has unconnected pin dina[11]
CRITICAL WARNING: [Synth 8-4442] BlackBox module \game_inst/sprite_rom  has unconnected pin dina[10]
CRITICAL WARNING: [Synth 8-4442] BlackBox module \game_inst/sprite_rom  has unconnected pin dina[9]
CRITICAL WARNING: [Synth 8-4442] BlackBox module \game_inst/sprite_rom  has unconnected pin dina[8]
CRITICAL WARNING: [Synth 8-4442] BlackBox module \game_inst/sprite_rom  has unconnected pin dina[7]
CRITICAL WARNING: [Synth 8-4442] BlackBox module \game_inst/sprite_rom  has unconnected pin dina[6]
CRITICAL WARNING: [Synth 8-4442] BlackBox module \game_inst/sprite_rom  has unconnected pin dina[5]
CRITICAL WARNING: [Synth 8-4442] BlackBox module \game_inst/sprite_rom  has unconnected pin dina[4]
CRITICAL WARNING: [Synth 8-4442] BlackBox module \game_inst/sprite_rom  has unconnected pin dina[3]
CRITICAL WARNING: [Synth 8-4442] BlackBox module \game_inst/sprite_rom  has unconnected pin dina[2]
CRITICAL WARNING: [Synth 8-4442] BlackBox module \game_inst/sprite_rom  has unconnected pin dina[1]
CRITICAL WARNING: [Synth 8-4442] BlackBox module \game_inst/sprite_rom  has unconnected pin dina[0]
---------------------------------------------------------------------------------
Finished IO Insertion : Time (s): cpu = 00:00:31 ; elapsed = 00:00:32 . Memory (MB): peak = 1029.410 ; gain = 484.879
---------------------------------------------------------------------------------
---------------------------------------------------------------------------------
Start Renaming Generated Instances
---------------------------------------------------------------------------------
---------------------------------------------------------------------------------
Finished Renaming Generated Instances : Time (s): cpu = 00:00:31 ; elapsed = 00:00:32 . Memory (MB): peak = 1029.410 ; gain = 484.879
---------------------------------------------------------------------------------

Report RTL Partitions: 
+-+--------------+------------+----------+
| |RTL Partition |Replication |Instances |
+-+--------------+------------+----------+
+-+--------------+------------+----------+

Report Check Netlist: 
+------+------------------+-------+---------+-------+------------------+
|      |Item              |Errors |Warnings |Status |Description       |
+------+------------------+-------+---------+-------+------------------+
|1     |multi_driven_nets |      0|        0|Passed |Multi driven nets |
+------+------------------+-------+---------+-------+------------------+
---------------------------------------------------------------------------------
Start Rebuilding User Hierarchy
---------------------------------------------------------------------------------
---------------------------------------------------------------------------------
Finished Rebuilding User Hierarchy : Time (s): cpu = 00:00:31 ; elapsed = 00:00:32 . Memory (MB): peak = 1029.410 ; gain = 484.879
---------------------------------------------------------------------------------
---------------------------------------------------------------------------------
Start Renaming Generated Ports
---------------------------------------------------------------------------------
---------------------------------------------------------------------------------
Finished Renaming Generated Ports : Time (s): cpu = 00:00:31 ; elapsed = 00:00:32 . Memory (MB): peak = 1029.410 ; gain = 484.879
---------------------------------------------------------------------------------
---------------------------------------------------------------------------------
Start Handling Custom Attributes
---------------------------------------------------------------------------------
---------------------------------------------------------------------------------
Finished Handling Custom Attributes : Time (s): cpu = 00:00:31 ; elapsed = 00:00:32 . Memory (MB): peak = 1029.410 ; gain = 484.879
---------------------------------------------------------------------------------
---------------------------------------------------------------------------------
Start Renaming Generated Nets
---------------------------------------------------------------------------------
---------------------------------------------------------------------------------
Finished Renaming Generated Nets : Time (s): cpu = 00:00:31 ; elapsed = 00:00:32 . Memory (MB): peak = 1029.410 ; gain = 484.879
---------------------------------------------------------------------------------
---------------------------------------------------------------------------------
Start Writing Synthesis Report
---------------------------------------------------------------------------------

Report BlackBoxes: 
+------+--------------+----------+
|      |BlackBox name |Instances |
+------+--------------+----------+
|1     |blk_mem_gen_0 |         1|
+------+--------------+----------+

Report Cell Usage: 
+------+--------------+------+
|      |Cell          |Count |
+------+--------------+------+
|1     |blk_mem_gen_0 |     1|
|2     |BUFG          |     2|
|3     |CARRY4        |    91|
|4     |DSP48E1       |     4|
|5     |DSP48E1_1     |     4|
|6     |LUT1          |    86|
|7     |LUT2          |   147|
|8     |LUT3          |    56|
|9     |LUT4          |   157|
|10    |LUT5          |   207|
|11    |LUT6          |   185|
|12    |FDCE          |   198|
|13    |FDPE          |    37|
|14    |FDRE          |    68|
|15    |FDSE          |     1|
|16    |IBUF          |     4|
|17    |IOBUF         |     2|
|18    |OBUF          |    41|
+------+--------------+------+

Report Instance Areas: 
+------+---------------------+----------------+------+
|      |Instance             |Module          |Cells |
+------+---------------------+----------------+------+
|1     |top                  |                |  1314|
|2     |  db_jump            |debounce        |    10|
|3     |  db_start           |debounce_0      |    10|
|4     |  display_inst       |SevenSegment    |    50|
|5     |  game_inst          |dino_logic      |   508|
|6     |    lfsr             |LFSR            |    45|
|7     |  kbd_decoder        |KeyboardDecoder |   236|
|8     |    inst             |KeyboardCtrl    |   212|
|9     |      Ps2Interface_i |Ps2Interface    |   177|
|10    |    op               |one_pulse_1     |     4|
|11    |  pclk_gen           |clock_divider   |     4|
|12    |  pulse_start        |one_pulse       |     2|
|13    |  vga_inst           |vga_controller  |   379|
+------+---------------------+----------------+------+
---------------------------------------------------------------------------------
Finished Writing Synthesis Report : Time (s): cpu = 00:00:31 ; elapsed = 00:00:32 . Memory (MB): peak = 1029.410 ; gain = 484.879
---------------------------------------------------------------------------------
Synthesis finished with 0 errors, 25 critical warnings and 480 warnings.
Synthesis Optimization Runtime : Time (s): cpu = 00:00:24 ; elapsed = 00:00:30 . Memory (MB): peak = 1029.410 ; gain = 362.602
Synthesis Optimization Complete : Time (s): cpu = 00:00:31 ; elapsed = 00:00:32 . Memory (MB): peak = 1029.410 ; gain = 484.879
INFO: [Project 1-571] Translating synthesized netlist
Netlist sorting complete. Time (s): cpu = 00:00:00 ; elapsed = 00:00:00.022 . Memory (MB): peak = 1029.410 ; gain = 0.000
INFO: [Netlist 29-17] Analyzing 101 Unisim elements for replacement
INFO: [Netlist 29-28] Unisim Transformation completed in 0 CPU seconds
INFO: [Project 1-570] Preparing netlist for logic optimization
INFO: [Opt 31-138] Pushed 0 inverter(s) to 0 load pin(s).
Netlist sorting complete. Time (s): cpu = 00:00:00 ; elapsed = 00:00:00 . Memory (MB): peak = 1029.410 ; gain = 0.000
INFO: [Project 1-111] Unisim Transformation Summary:
  A total of 2 instances were transformed.
  IOBUF => IOBUF (IBUF, OBUFT): 2 instances

INFO: [Common 17-83] Releasing license: Synthesis
83 Infos, 147 Warnings, 25 Critical Warnings and 0 Errors encountered.
synth_design completed successfully
synth_design: Time (s): cpu = 00:00:36 ; elapsed = 00:00:37 . Memory (MB): peak = 1029.410 ; gain = 731.090
Netlist sorting complete. Time (s): cpu = 00:00:00 ; elapsed = 00:00:00.001 . Memory (MB): peak = 1029.410 ; gain = 0.000
WARNING: [Constraints 18-5210] No constraints selected for write.
Resolution: This message can indicate that there are no constraints for the design, or it can indicate that the used_in flags are set such that the constraints are ignored. This later case is used when running synth_design to not write synthesis constraints to the resulting checkpoint. Instead, project constraints are read when the synthesized design is opened.
INFO: [Common 17-1381] The checkpoint 'C:/Users/jaylu/Desktop/Ethan/HardwareDesign_finalproject/Hardware_Design_Lab_Final_Project/Final_Project/Final_Project.runs/synth_1/dino_top.dcp' has been generated.
INFO: [runtcl-4] Executing : report_utilization -file dino_top_utilization_synth.rpt -pb dino_top_utilization_synth.pb
INFO: [Common 17-206] Exiting Vivado at Fri Dec 19 00:53:57 2025...
